{
    "$schema": "../config.schema.json",
    "type": "sdxl",
    "model": "urn:air:sdxl:checkpoint:civitai:827184@2514310",
    "vae": null,
    "loras": [
        {
            "ref": "https://huggingface.co/datasets/beamman/hakidame_lora/resolve/main/hk_szk001-000020.safetensors",
            "triggers": [
                "hk_szk",
                "1girl",
                "red eyes",
                "daemon girl",
                "horns",
                "daemon tail",
                "pink long hair",
                "gradient hair",
                "medium breasts",
                "(messy hair:0.5)"
            ],
            "weight": 0.8,
            "trigger_weight": 1
        }
    ],
    "training_resolution": 1024,
    "default_steps": 20,
    "default_cfg": 7.0,
    "default_sampler": "euler_a"
}
