{
    "$schema": "../config.schema.json",
    "type": "sdxl",
    "model": "urn:air:sdxl:checkpoint:civitai:823763@1892440",
    "vae": null,
    "loras": [],
    "training_resolution": 1536,
    "default_steps": 20,
    "default_cfg": 7.0,
    "default_sampler": "euler_a",
    "output_format": "webp"
}
